{
  "schema_version": "1.0.0",
  "record_type": "evidence_review",
  "id": "evidence-review-nad-and-redox-restoration-coverage-repair-2026-06-08-safety-limitations-r1",
  "name": "Safety Limitations review for Nad And Redox Restoration bundle",
  "candidate_bundle_id": "nad-and-redox-restoration-coverage-repair-2026-06-08",
  "bundle_revision_number": 1,
  "review_round": 1,
  "review_lane": "safety_limitations",
  "reviewer_kind": "agent",
  "status": "complete",
  "verdict": "accept",
  "blocking": false,
  "summary": "The staged records adequately preserve safety, tolerability, duration, and risk-benefit limitations for revision 1. MIB-626 evidence remains short-duration and partly disease-context, the NR/NMN/MitoQ registry records provide no posted safety or efficacy results, and the review-boundary records keep chronic preventive-use, precision NAD modulation, supplement/formulation heterogeneity, redox balance, durability, and oncology/context-specific safety caveats visible. No safety omission blocks editorial review.",
  "reviewed_change_ids": [
    "create-intervention-mib-626",
    "create-source-pmid-35182418",
    "create-source-pmid-36740954",
    "create-source-pmid-40746868",
    "create-study-mib-626-pkpd-overweight-older-adults",
    "create-study-mib-626-physiology-overweight-older-adults",
    "create-study-mib-626-covid-aki-rct",
    "create-finding-mib-626-raised-nad-metabolome-older-adults",
    "create-finding-mib-626-metabolic-signal-no-physical-function",
    "create-finding-mib-626-covid-aki-target-engagement-no-clinical-benefit",
    "create-source-nct-05878119",
    "create-source-nct-05759468",
    "create-source-nct-06208527",
    "create-source-nct-04691986",
    "create-source-nct-04430517",
    "create-source-nct-03821623",
    "create-source-nct-06425042",
    "create-source-nct-06592859",
    "create-source-nct-07144527",
    "create-source-nct-04851288",
    "create-source-nct-06027554",
    "create-source-nct-05561556",
    "create-study-mib-626-exercise-training-phase2-registry",
    "create-finding-mib-626-exercise-phase2-completed-no-results",
    "create-study-mib-626-diabetic-kidney-disease-registry",
    "create-finding-mib-626-diabetic-kidney-disease-recruiting-no-results",
    "create-study-nadage-nicotinamide-riboside-frailty-registry",
    "create-finding-nadage-nr-frailty-recruiting-no-results",
    "create-study-nicotinamide-riboside-older-veterans-muscle-registry",
    "create-finding-nr-older-veterans-active-no-results",
    "create-study-nicotinamide-riboside-mci-alzheimers-bioenergetics-registry",
    "create-finding-nr-alzheimer-bioenergetics-active-no-results",
    "create-study-nicotinamide-riboside-arterial-stiffness-registry",
    "create-finding-nr-arterial-stiffness-recruiting-no-results",
    "create-study-nicotinamide-riboside-exercise-longevity-registry",
    "create-finding-nr-exercise-longevity-recruiting-no-results",
    "create-study-nmn-middle-aged-older-adults-registry",
    "create-finding-nmn-middle-aged-older-adults-recruiting-no-results",
    "create-study-nmn-exercise-tolerance-older-adults-registry",
    "create-finding-nmn-exercise-tolerance-recruiting-no-results",
    "create-study-mitoq-vascular-aging-registry",
    "create-finding-mitoq-vascular-aging-active-no-results",
    "create-study-mitoq-frail-older-adults-registry",
    "create-finding-mitoq-frail-older-adults-recruiting-no-results",
    "create-study-mitoq-vascular-oxidative-stress-registry",
    "create-finding-mitoq-vascular-oxidative-stress-completed-no-results",
    "create-source-pmid-42068909",
    "create-finding-nad-redox-review-supports-combination-boundary",
    "create-source-pmid-42234350",
    "create-finding-targeted-supplementation-review-heterogeneity-boundary",
    "create-source-pmid-42186383",
    "create-finding-glutathione-precursor-review-replication-gap",
    "create-source-pmid-41812700",
    "create-finding-nad-homeostasis-review-precision-safety-boundary",
    "create-source-pmid-41933553",
    "create-finding-vascular-aging-review-mitoq-translational-boundary",
    "update-outlook-track-nad-and-redox-restoration-outlook"
  ],
  "findings": [
    {
      "finding_id": "nad-precursor-chronic-safety-unresolved",
      "severity": "note",
      "category": "safety_limitation",
      "applies_to_change_id": "update-outlook-track-nad-and-redox-restoration-outlook",
      "applies_to_record": {
        "record_type": "outlook",
        "record_id": "track-nad-and-redox-restoration-outlook"
      },
      "claim_or_issue": "The staged outlook correctly treats chronic preventive use of NAD precursors and related redox interventions as unresolved.",
      "why_it_matters": "Short biomarker and physiology trials do not establish long-term tolerability, durability, optimal population selection, oncology/context-specific risk, or preventive-use risk-benefit.",
      "recommended_action": "Keep the chronic safety, durability, supplement/formulation, and precision NAD caveats in the public outlook.",
      "resolution_status": "open"
    },
    {
      "finding_id": "mib-626-short-duration-safety-boundary",
      "severity": "note",
      "category": "safety_limitation",
      "applies_to_change_id": "create-finding-mib-626-raised-nad-metabolome-older-adults",
      "applies_to_record": {
        "record_type": "finding",
        "record_id": "mib-626-raised-nad-metabolome-older-adults"
      },
      "claim_or_issue": "MIB-626 was well tolerated in the staged short trials, but the exposure windows are too brief to support chronic aging-prevention safety.",
      "why_it_matters": "Fourteen- to twenty-eight-day tolerability and metabolite shifts cannot resolve long-term dosing, adherence, tissue-specific effects, or adverse-event risk in broad older-adult use.",
      "recommended_action": "Keep MIB-626 safety language limited to short-term tolerability and require longer controlled data before increasing safety confidence.",
      "resolution_status": "open"
    },
    {
      "finding_id": "disease-context-not-preventive-safety",
      "severity": "note",
      "category": "safety_limitation",
      "applies_to_change_id": "create-finding-mib-626-covid-aki-target-engagement-no-clinical-benefit",
      "applies_to_record": {
        "record_type": "finding",
        "record_id": "mib-626-covid-aki-target-engagement-no-clinical-benefit"
      },
      "claim_or_issue": "The COVID-19 acute kidney injury trial contributes disease-context target-engagement and short-term safety information, not a preventive geroscience risk-benefit readout.",
      "why_it_matters": "Hospitalized disease-context tolerability cannot be generalized to chronic healthy-aging use or to prevention populations without additional evidence.",
      "recommended_action": "Preserve the disease-context boundary and avoid using this record to broaden preventive-use safety claims.",
      "resolution_status": "open"
    },
    {
      "finding_id": "redox-antioxidant-balance-boundary",
      "severity": "note",
      "category": "safety_limitation",
      "applies_to_change_id": "create-finding-vascular-aging-review-mitoq-translational-boundary",
      "applies_to_record": {
        "record_type": "finding",
        "record_id": "vascular-aging-review-mitoq-translational-boundary"
      },
      "claim_or_issue": "The staged MitoQ and redox review context keeps translational and redox-balance caveats rather than treating mitochondrial antioxidants as broadly safe chronic geroprotectors.",
      "why_it_matters": "Oxidative-stress modulation can be context-specific, and registry activity without results does not establish long-term benefit or safety.",
      "recommended_action": "Keep MitoQ and antioxidant records as bounded translational context until controlled older-adult outcome and safety data are available.",
      "resolution_status": "open"
    }
  ],
  "skill_name": "lev-evidence-review",
  "created_at": "2026-06-09T10:38:57.173Z",
  "updated_at": "2026-06-09T10:38:57.173Z"
}
