{
  "schema_version": "1.0.0",
  "record_type": "evidence_review",
  "id": "evidence-review-partial-reprogramming-coverage-repair-2026-06-12-safety-limitations-r1",
  "name": "Safety Limitations review for Partial Reprogramming bundle",
  "candidate_bundle_id": "partial-reprogramming-coverage-repair-2026-06-12",
  "bundle_revision_number": 1,
  "review_round": 1,
  "review_lane": "safety_limitations",
  "reviewer_kind": "agent",
  "status": "complete",
  "verdict": "accept",
  "blocking": false,
  "summary": "Safety-limitations review accepts revision 1. The staged bundle does not minimize safety risk: it includes the Abad full-reprogramming teratoma boundary, the Sahu targeted OSK tumor-incidence caveat, the 2026 review's schedule/delivery/safety-pharmacology checklist, and the ER-100 phase 1 no-results registry as safety activity rather than safety proof. The outlook keeps delivery control, durability, immune response, tissue specificity, tumorigenicity, and dedifferentiation as central blockers.",
  "reviewed_change_ids": [
    "create-source-pmid-27984723",
    "create-source-pmid-33268865",
    "create-source-pmid-37118377",
    "create-source-pmid-38381405",
    "create-source-pmid-39259812",
    "create-source-pmid-24025773",
    "create-source-pmid-39267613",
    "create-source-pmid-41490578",
    "create-source-nct-07290244",
    "create-study-ocampo-cyclic-oskm-mouse-partial-reprogramming",
    "create-study-lu-osk-retinal-reprogramming-vision-mice",
    "create-study-browder-long-term-oskm-physiological-aging-mice",
    "create-study-macip-aav-osk-aged-mouse-lifespan",
    "create-study-sahu-cdkn2a-osk-aged-cell-targeted-mice",
    "create-study-abad-in-vivo-oskm-full-reprogramming-teratoma",
    "create-study-toraason-neuronal-reprogramming-factor-worm-cognition",
    "create-study-li-tay-epigenetic-rejuvenation-review",
    "create-study-er100-optic-neuropathy-phase1",
    "create-finding-cyclic-oskm-ameliorated-aged-mouse-hallmarks",
    "create-finding-osk-restored-retinal-function-epigenetic-state-mice",
    "create-finding-long-term-oskm-reverted-age-molecular-signatures-mice",
    "create-finding-aav-osk-extended-remaining-lifespan-aged-mice",
    "create-finding-cdkn2a-osk-extended-life-and-health-markers-mice",
    "create-finding-in-vivo-oskm-full-reprogramming-teratoma-risk",
    "create-finding-neuronal-osk-orthologs-worm-null-cognition-lifespan",
    "create-finding-partial-reprogramming-review-safety-delivery-checklist",
    "create-finding-er100-phase1-recruiting-no-results",
    "update-outlook-track-partial-reprogramming"
  ],
  "findings": [
    {
      "finding_id": "safety-limitations-kept-visible",
      "severity": "note",
      "category": "safety_limitation",
      "applies_to_change_id": "update-outlook-track-partial-reprogramming",
      "applies_to_record": {
        "record_type": "outlook",
        "record_id": "track-partial-reprogramming-outlook"
      },
      "claim_or_issue": "The staged public wording keeps safety and delivery uncertainty adjacent to the positive animal signals.",
      "why_it_matters": "Partial reprogramming has high upside but unusually important control risks; a public update would be misleading if tumorigenicity, dedifferentiation, immune response, durability, or vector control were treated as solved.",
      "recommended_action": "Accept the safety framing; maintain high-priority surveillance for ER-100 safety results and independent long-term animal safety replication.",
      "resolution_status": "closed"
    }
  ],
  "skill_name": "lev-evidence-review",
  "created_at": "2026-06-12T13:29:03.132Z",
  "updated_at": "2026-06-12T13:29:03.132Z"
}
