{
  "schema_version": "1.0.0",
  "record_type": "evidence_review",
  "id": "evidence-review-immune-rejuvenation-interpretation-r1",
  "name": "Interpretation review for immune rejuvenation bundle",
  "candidate_bundle_id": "immune-rejuvenation-update-2026-05-30",
  "bundle_revision_number": 1,
  "review_round": 1,
  "review_lane": "interpretation_forecast",
  "reviewer_kind": "human",
  "reviewer_id": "tyler",
  "status": "complete",
  "verdict": "accept",
  "blocking": false,
  "summary": "The public-facing language is stronger and clearer, but it still stops short of claiming aging reversal or a stage move.",
  "created_at": "2026-05-30T18:25:00Z",
  "reviewed_change_ids": [
    "refresh-immune-rejuvenation-outlook"
  ],
  "findings": []
}
