{
  "schema_version": "1.0.0",
  "record_type": "evidence_review",
  "id": "evidence-review-partial-reprogramming-source-fidelity-r2",
  "name": "Source fidelity review for revised partial reprogramming bundle",
  "candidate_bundle_id": "partial-reprogramming-update-2026-05-29",
  "bundle_revision_number": 2,
  "review_round": 2,
  "review_lane": "source_fidelity",
  "reviewer_kind": "agent",
  "skill_name": "lev-evidence-review",
  "status": "complete",
  "verdict": "accept",
  "blocking": false,
  "summary": "The revised text accurately states the absence of direct human intervention evidence and keeps the mechanistic claims bounded.",
  "created_at": "2026-05-30T18:10:00Z",
  "reviewed_change_ids": [
    "revise-partial-reprogramming-outlook"
  ],
  "findings": [
    {
      "finding_id": "partial-r2-source-boundary-note",
      "severity": "note",
      "category": "uncertainty",
      "applies_to_change_id": "revise-partial-reprogramming-outlook",
      "applies_to_record": {
        "record_type": "outlook",
        "record_id": "track-partial-reprogramming-outlook"
      },
      "claim_or_issue": "The public note remains interpretive because the track has no direct human intervention efficacy record.",
      "why_it_matters": "This keeps readers from confusing mechanistic promise with demonstrated translation.",
      "recommended_action": "Retain explicit wording that the change is interpretive discipline rather than a signal upgrade.",
      "resolution_status": "closed"
    }
  ]
}
