{
  "schema_version": "1.0.0",
  "record_type": "evidence_review",
  "id": "evidence-review-rapalogs-coverage-repair-2026-06-11-source-fidelity-r1",
  "name": "Source Fidelity review for Rapalogs bundle",
  "candidate_bundle_id": "rapalogs-coverage-repair-2026-06-11",
  "bundle_revision_number": 1,
  "review_round": 1,
  "review_lane": "source_fidelity",
  "reviewer_kind": "agent",
  "status": "complete",
  "verdict": "accept",
  "blocking": false,
  "summary": "Source fidelity passes for revision 1. PubMed and ClinicalTrials.gov checks on June 11, 2026 matched the staged source titles, DOI/date metadata, registry status, enrollment, completion timing, and no-results boundaries. PEARL is correctly treated as result-bearing through the peer-reviewed PubMed paper while its registry remains marked as having no posted results.",
  "reviewed_change_ids": [
    "create-source-pmid-40188830",
    "create-study-pearl-rapamycin-healthspan-trial",
    "create-finding-pearl-rapamycin-one-year-safety-healthspan-mixed",
    "create-source-pmid-19587680",
    "create-study-harrison-rapamycin-late-life-mouse-lifespan",
    "create-finding-rapamycin-late-life-extends-mouse-lifespan",
    "create-source-pmid-40532901",
    "create-study-rapamycin-vertebrate-lifespan-meta-analysis",
    "create-finding-rapamycin-vertebrate-lifespan-meta-analysis-boundary",
    "create-source-pmid-37142830",
    "create-study-mtor-inhibitors-aging-review",
    "create-finding-mtor-inhibitors-aging-human-translation-boundary",
    "create-source-nct-07354620",
    "create-study-reverse-rapamycin-prolon-registry",
    "create-finding-reverse-rapamycin-prolon-active-no-results",
    "create-source-nct-05835999",
    "create-study-everolimus-aging-geroprotection-registry",
    "create-finding-everolimus-aging-active-no-results",
    "create-source-nct-06658093",
    "create-study-restor-mtori-older-adults-registry",
    "create-finding-restor-mtori-older-adults-recruiting-no-results",
    "create-source-nct-04742777",
    "create-study-rapa-cmri-older-adults-registry",
    "create-finding-rapa-cmri-older-adults-completed-no-results",
    "create-source-nct-05949658",
    "create-study-rap-pac-rapalog-pharmacology-registry",
    "create-finding-rap-pac-rapalog-pharmacology-recruiting-no-results",
    "create-finding-sirolimus-older-adults-recruiting-no-results",
    "update-study-oral-rapamycin-older-adult-feasibility",
    "update-finding-oral-rapamycin-older-adults-short-term-safety-no-functional-change",
    "update-study-topical-rapamycin-human-skin-aging",
    "update-finding-topical-rapamycin-reduced-human-skin-p16",
    "update-outlook-track-rapalogs"
  ],
  "findings": [
    {
      "finding_id": "pearl-registry-paper-results-boundary",
      "severity": "note",
      "category": "source_mismatch",
      "applies_to_change_id": "create-finding-pearl-rapamycin-one-year-safety-healthspan-mixed",
      "applies_to_record": {
        "record_type": "finding",
        "record_id": "pearl-rapamycin-one-year-safety-healthspan-mixed"
      },
      "claim_or_issue": "The bundle treats PEARL as result-bearing because the PubMed-indexed paper is staged, while the ClinicalTrials.gov registry still has no posted results section.",
      "why_it_matters": "Keeping that boundary explicit avoids treating the registry itself as posted outcome evidence and keeps source provenance clear.",
      "recommended_action": "No revision needed; the staged source and study records preserve the paper-versus-registry distinction.",
      "resolution_status": "closed"
    }
  ],
  "skill_name": "lev-evidence-review",
  "created_at": "2026-06-11T17:29:37.533Z",
  "updated_at": "2026-06-11T17:29:37.533Z"
}
